{
  "contract": {
    "name": "seam-contract",
    "version": 2,
    "status": "frozen",
    "frozen_by": "U0 (task t_9b97698a)",
    "frozen_at_plan_sha256": "1f7cd6d13c65457581d84e8f30810549f177cdea9c2a9c18462b668183ec5e7e",
    "supersedes": "seam-contract/1 (implicit, never frozen as a document)",
    "amendment_rule": "Amendments are recorded as decisions with the contract version bumped and the digest recomputed. U6 judges against a specific contract SHA."
  },
  "candidate_pin": {
    "base_commit": "e2427daf3d7f5ef90b0dc196d89fee4a2debb0d4",
    "base_branch": "backup/bounded-review-feedback",
    "repo": "jhaynes/hermes-agent",
    "phase_a_receipt_sha256": "78287727b9281e5d8a7ce4bb8c19da6ffc8753c8c8d455a589cff73cf199b200",
    "phase_a_verdict": "candidate_seam_contract_failed",
    "contract_gaps_at_phase_a": [
      "C1 gap: no configurable termination_reserve_seconds (deadline hard-derived time.time()+cap, kanban_review_state.py:169)",
      "C2 gap: no verified process-group identity (group exists via start_new_session but never verified/recorded/enumerated)",
      "C3 gap: no native cohort export with generation/watermark/completeness fields or finalized-through fence",
      "C4 gap: review_actions.deadline is wall-clock, not boot-scoped monotonic with half-open not_before/expires_at",
      "C5 gap: no armed->released command-release token; arming and release are the same dispatcher tick"
    ]
  },
  "capabilities": [
    {
      "id": "C1",
      "title": "Configurable termination reserve",
      "plan_v2_basis": "plan v2:147 (launcher subtracts reserve from both enforcement boundaries), 472 (config source, two-stage validation), 474 (insufficient_safe_window)",
      "caller": {
        "who": "the gated launcher (C5) and the supervisor; the config loader at kanban.review_feedback is the single source. Harness-side read lives in hermes-config Phase B slices, not the candidate.",
        "module_surface": "kanban_review_state.py config path; launcher/supervisor deadline construction"
      },
      "preconditions": [
        "(a) at config load \u2014 `termination_reserve_seconds` is a finite positive integer, and smaller than every issuable lease/cap duration",
        "(b) at every lease issuance \u2014 `remaining > reserve`."
      ],
      "atomic_persistence": "the effective reserve value is recorded per action in the lease/receipt row in the same claim transaction that issues the lease. Config changes apply only to actions reserved after the change \u2014 never retroactively; receipts keep the value each action actually used.",
      "generation_watermark": "n/a.",
      "idempotency": "re-reading config does not rewrite recorded reserves; an action's recorded reserve is immutable once issued.",
      "typed_failures": [
        "invalid_reserve_config",
        "insufficient_safe_window",
        "reserve_exceeds_boundary"
      ],
      "readback": "the per-action recorded reserve is visible in the lease/receipt row via the supported export; the harness reads the effective value, never the config default.",
      "probes": [
        "U1-config-validation",
        "U1-insufficient-window",
        "U1-boundary-subtraction",
        "U1-reserve-recorded-per-action",
        "U1-default-60"
      ],
      "implementation_unit": "U1"
    },
    {
      "id": "C2",
      "title": "Verified process-group containment",
      "plan_v2_basis": "plan v2:200 (mandatory proof cases), plan v2:23 (setsid residual accepted, detected and recorded, never claimed prevented)",
      "caller": {
        "who": "the supervisor/dispatcher supervision path only. start_new_session=True is kept - it is deliberate and already gives the launcher/worker a private session and process group.",
        "module_surface": "kanban_db_dispatch.py spawn path; supervisor in kanban_review_state.py"
      },
      "preconditions": [
        "the spawned launcher/worker pgid is verified to match the recorded pid and its start identity before any signal may be sent to the group",
        "killpg invariants hold fail-closed \u2014 never signal pgid <= 1, never signal the supervisor's own group, never signal a group whose recorded (pid, start identity) no longer matches the live check."
      ],
      "atomic_persistence": "pgid + leader start identity persist in the `armed` transaction (with C5), not at spawn time alone.",
      "generation_watermark": "n/a.",
      "idempotency": "survivor enumeration is a read; repeated scans are idempotent. Re-verification at signal time is mandatory, not cached.",
      "typed_failures": [
        "containment_identity_mismatch",
        "self_group_refused",
        "survivors_recorded"
      ],
      "readback": "recorded group identity and survivor lists are visible in the receipt/watchdog row via the supported export.",
      "probes": [
        "U2-pgid-verified-at-arm",
        "U2-child-grandchild",
        "U2-shell-wrapper",
        "U2-ignored-sigterm",
        "U2-parent-exit",
        "U2-supervisor-death-after-release",
        "U2-pid-reuse-deterministic",
        "U2-stale-group-reuse-deterministic",
        "U2-self-group-refused",
        "U2-survivor-enumeration"
      ],
      "implementation_unit": "U2"
    },
    {
      "id": "C3",
      "title": "Cohort generation/watermark export and finalization fence",
      "plan_v2_basis": "plan v2:182 (watermark = authorization sequence; finalization fence), plan v2:86 (board identity anchor), plan v2:202 (native atomic admission fence; four race cases)",
      "caller": {
        "who": "the managed-claim transaction allocates the authorization sequence; a single native finalization op is the only fence writer; the read-only export is available to the config harness/validator.",
        "module_surface": "kanban_review_cohort.py + managed-claim transaction in kanban_review_state.py"
      },
      "preconditions": [
        "export ordering is fixed and tested: sequence allocation -> claim commit -> export snapshot (one complete read of committed state) -> finalization (fixes `finalized_through` and `exhausted_at`) -> receipt eligibility."
      ],
      "atomic_persistence": "finalization is ONE transaction: disables further cohort claims, includes every committed claim through the watermark, fixes the complete generation and `exhausted_at`, marks receipt eligibility pending/settled. Isolation: `BEGIN IMMEDIATE` / single-writer semantics on the board DB; claim-vs-fence tests run across separate OS processes, not threads.",
      "generation_watermark": "native cohort exports carry: board identity (`workflow_board.board_id` paired with canonical DB path + filesystem device recorded at creation), authorization sequence (allocated in the managed-claim transaction), export generation, `finalized_through` watermark, completeness flag. An earlier-starting sibling committed before the fence but closed late keeps finalization pending (plan v2:182).",
      "idempotency": "repeating a finalization for the same generation returns the same finalized record; a post-fence claim fails the fence. A copied DB at a different canonical path/device is rejected; a legitimately restored board re-identifies only via a new operator decision record naming the restore (same authority class as enrollment); otherwise path/device mismatch holds.",
      "typed_failures": [
        "cohort_claim_fenced",
        "board_identity_mismatch",
        "finalization_pending",
        "partial_observation"
      ],
      "readback": "the cohort export is the supported read-only path carrying identity + generation + watermark + completeness; `show --json` disagreement can only place the projection in `reconciliation_required`, never alter native state.",
      "probes": [
        "U3-export-fields",
        "U3-export-ordering",
        "U3-committed-not-exported",
        "U3-concurrent-claim-vs-fence",
        "U3-post-fence-claim-refused",
        "U3-finalization-vs-exhaustion",
        "U3-copied-db-rejected",
        "U3-restore-needs-decision"
      ],
      "implementation_unit": "U3"
    },
    {
      "id": "C4",
      "title": "Boot-scoped monotonic lease bounds",
      "plan_v2_basis": "plan v2:145 (one boot-scoped monotonic domain; cross-boot comparisons illegal), plan v2:147 (boundary rules), plan v2:213 (timeout = min of command cap, lease remaining, allowance remaining)",
      "caller": {
        "who": "the launcher (deadline construction and every comparison) and the supervisor (enforcement boundaries); every deadline comparison in the review seam is replumbed to this domain.",
        "module_surface": "kanban_review_state.py claimed()/settle_clock(); launcher deadline construction"
      },
      "preconditions": [
        "lease `not_before`/`expires_at`, command start/finish, and `exhausted_at` all persist in one boot-scoped monotonic domain",
        "wall time is audit/correlation only. Clock choice (frozen): `CLOCK_BOOTTIME` via `time.clock_gettime(time.CLOCK_BOOTTIME)` \u2014 monotonic-including-suspend",
        "Python's `time.monotonic()` excludes suspend on Linux and would undercharge a suspended host. Boot identity source: `/proc/sys/kernel/random/boot_id`."
      ],
      "atomic_persistence": "lease bounds persist in the claim transaction (with C5's `claimed_unarmed` persistence); command start/finish endpoints persist at observation.",
      "generation_watermark": "`exhausted_at` participates in the C3 finalization fence.",
      "idempotency": "replayed endpoints are idempotent; a previously trusted open prefix is never lowered by a later earlier endpoint \u2014 high-water retained, discrepancy recorded, hold for reconciliation.",
      "typed_failures": [
        "cross_boot_comparison",
        "clock_reconciliation_required",
        "boot_discontinuity",
        "insufficient_safe_window"
      ],